<?xml version="1.0" encoding="ISO-8859-1"?>
<!DOCTYPE Journals SYSTEM "../../../dtd/Journals.dtd">
<Journals>
  <name>Journals</name>
  <Journal>
    <abbr>DIV</abbr>
    <name>Diversen</name>
    <type>default</type>
  </Journal>
  <Journal>
    <abbr>TAY</abbr>
    <name>Tay</name>
    <type>default</type>
  </Journal>
  <Journal>
    <abbr>TRF</abbr>
    <name>Transfer</name>
    <type>default</type>
  </Journal>
    <CurrentObject>Diversen</CurrentObject>
</Journals>
